{
  "$schema": "../plugins/editorial-os/schema/eos.config.schema.json",
  "version": 1,
  "publication": {
    "id": "acrr",
    "name": "ACRR",
    "fullName": "Advanced Computing & Robotics Research",
    "url": "https://acrr.asia",
    "standards": "editorial/standards.md",
    "identity": "An independent research and technical publication on computing, control, robotics and the engineering methods that connect them. It explains established methods carefully, states assumptions and limits, and keeps facts, interpretations and open questions apart.",
    "audience": "Engineering and computer-science students from the second year of a degree upwards, practising engineers moving into an adjacent field, and researchers who want a careful reference. Readers know calculus and basic linear algebra and can read Python; each series states anything beyond that."
  },
  "language": {
    "variant": "en-US",
    "serialComma": false,
    "contractions": "avoid",
    "headingCase": "sentence",
    "titleCase": "headline"
  },
  "content": {
    "root": ".",
    "types": {
      "article": {
        "label": "Article",
        "globs": [
          "src/content/blog/*.mdx",
          "src/content/blog/*.md"
        ],
        "route": "/blog/{slug}",
        "rubric": "article",
        "requiredFields": [
          "title",
          "description",
          "publishedAt"
        ]
      },
      "insight": {
        "label": "Insight",
        "globs": [
          "src/content/insights/*.md",
          "src/content/insights/*.mdx"
        ],
        "route": "/insights/{slug}",
        "rubric": "insight",
        "requiredSections": [
          "Established",
          "Interpretation",
          "Open questions"
        ],
        "requiredFields": [
          "title",
          "description",
          "publishedAt"
        ]
      },
      "series": {
        "label": "Series overview",
        "globs": [
          "src/content/series/*.md"
        ],
        "route": "/series/{slug}",
        "rubric": "series",
        "isSeriesIndex": true,
        "requiredFields": [
          "title",
          "description",
          "status"
        ]
      }
    },
    "exclude": [
      "src/content/**/vi/**"
    ],
    "fields": {
      "title": "title",
      "description": "description",
      "published": "publishedAt",
      "updated": "updatedAt",
      "series": "series",
      "seriesOrder": "seriesOrder",
      "draft": "draft",
      "example": "example",
      "status": "status",
      "plannedEntries": "plannedEntries"
    },
    "seriesArticle": {
      "requiredSections": [
        "Summary",
        "References"
      ],
      "entryNoun": "entry"
    },
    "pages": {
      "dist": "dist",
      "routes": [
        "/",
        "/about",
        "/learning",
        "/blog",
        "/series",
        "/insights",
        "/tags",
        "/404"
      ],
      "sources": {
        "/": "src/views/Home.astro",
        "/about": "src/views/About.astro",
        "/learning": "src/views/Learning.astro + src/data/learning.json",
        "/blog": "src/views/BlogIndex.astro",
        "/series": "src/views/SeriesIndex.astro",
        "/insights": "src/views/InsightsIndex.astro",
        "/tags": "src/views/TagsIndex.astro",
        "/404": "src/pages/404.astro"
      },
      "prefixes": [
        "/tags/",
        "/blog/category/",
        "/vi/"
      ]
    },
    "translations": {
      "vi": "{dir}/vi/{file}"
    }
  },
  "thresholds": {
    "titleMaxChars": 70,
    "descriptionMinChars": 70,
    "descriptionMaxChars": 165,
    "sentenceMaxWords": 45,
    "paragraphMaxWords": 170,
    "headingMaxWords": 12
  },
  "glossary": "editorial/glossary.json",
  "rules": {
    "spelling-variant": "error",
    "terminology": "warning",
    "phrases": "warning",
    "intensifiers": "suggestion",
    "contractions": "warning",
    "doubled-word": "error",
    "placeholder": "error",
    "sentence-length": "suggestion",
    "paragraph-length": "suggestion",
    "exclamation": "warning",
    "heading-levels": "error",
    "heading-case": "warning",
    "heading-numbering": "warning",
    "heading-punctuation": "warning",
    "heading-duplicate": "warning",
    "heading-length": "suggestion",
    "title-length": "warning",
    "description-length": "warning",
    "description-form": "warning",
    "required-fields": "error",
    "required-sections": "error",
    "series-sections": "warning",
    "opening-paragraph": "warning",
    "internal-link": "error",
    "series-crossref": "error",
    "link-text": "warning",
    "math-balance": "error",
    "acronym-expansion": "suggestion",
    "reference-format": "suggestion"
  },
  "acronyms": {
    "known": [
      "AC",
      "DC",
      "CPU",
      "RAM",
      "ROM",
      "USB",
      "PDF",
      "HTML",
      "CSS",
      "URL",
      "API",
      "JSON",
      "XML",
      "HTTP",
      "HTTPS",
      "TCP",
      "IP",
      "UDP",
      "IEEE",
      "IEC",
      "ISO",
      "NIST",
      "RFC",
      "SI",
      "MDX",
      "ID",
      "IDs",
      "OK",
      "UTC",
      "ASCII",
      "UTF",
      "GPU",
      "LED",
      "PC",
      "OS",
      "PhD",
      "IETF",
      "W3C",
      "FIDO",
      "TLS",
      "DNS",
      "RGB",
      "SQL",
      "AI",
      "ML"
    ]
  },
  "references": {
    "sectionHeadings": [
      "References",
      "Further reading"
    ],
    "policy": "Cite primary or authoritative sources: standards, RFCs, peer-reviewed papers, textbooks from established publishers and official documentation. Every entry must be verifiable; never invent a reference, edition, year or URL. URLs are added only when they have been checked."
  },
  "review": {
    "recordsDir": "editorial/records",
    "auditDir": "editorial/audit",
    "stages": [
      "developmental",
      "copy",
      "factCheck",
      "technical",
      "series",
      "publishing",
      "qa"
    ],
    "requiredStages": {
      "article": [
        "developmental",
        "copy",
        "factCheck",
        "technical",
        "publishing",
        "qa"
      ],
      "insight": [
        "developmental",
        "copy",
        "factCheck",
        "technical",
        "publishing",
        "qa"
      ],
      "series": [
        "developmental",
        "copy",
        "series",
        "publishing",
        "qa"
      ]
    },
    "minimumTotal": {
      "article": 24,
      "insight": 22,
      "series": 22
    },
    "minimumPerDimension": 3
  },
  "validation": {
    "commands": [
      {
        "name": "Build (types, schemas, MDX, KaTeX, Mermaid, search index)",
        "run": "npm run build",
        "env": {
          "SITE_URL": "https://acrr.asia"
        }
      },
      {
        "name": "Internal links and fragments",
        "run": "npm run check:links"
      },
      {
        "name": "Series review gate",
        "run": "node scripts/series-pipeline.mjs gate"
      }
    ],
    "site": {
      "dist": "dist",
      "ignore": [
        "pagefind/**"
      ],
      "maxDiagramMinWidthPx": 620,
      "descriptionMaxChars": 170,
      "ignoreDuplicateIds": [
        "^actor-man-(torso|arms)\\d+$"
      ]
    }
  },
  "properNouns": [
    "Kalman",
    "Fourier",
    "Laplace",
    "Python",
    "Ethernet",
    "Bode",
    "Nyquist",
    "Euler",
    "Runge",
    "Kutta",
    "Newton",
    "Gauss",
    "Seidel",
    "Jacobi",
    "Lyapunov",
    "Hurwitz",
    "Routh",
    "Bayes",
    "Markov",
    "Galerkin",
    "Dirichlet",
    "Neumann",
    "Courant",
    "Friedrichs",
    "Lewy",
    "Crank",
    "Nicolson",
    "Taylor",
    "Hamming",
    "Hann",
    "Butterworth",
    "Chebyshev",
    "Parseval",
    "Nyquist",
    "Shannon",
    "Ziegler",
    "Nichols",
    "Ackermann",
    "Denavit",
    "Hartenberg",
    "Rodrigues",
    "Hamilton",
    "Modbus",
    "Profinet",
    "EtherCAT",
    "EtherNet",
    "Linux",
    "FreeRTOS",
    "Arduino",
    "Cortex",
    "Krylov",
    "Arnoldi",
    "Lanczos",
    "Cholesky",
    "Householder",
    "Givens",
    "Wiener",
    "Kalman",
    "Jacobian",
    "Hessian",
    "Gaussian",
    "Bernoulli",
    "Poisson",
    "Johnson",
    "Allan",
    "Wheatstone",
    "Hall",
    "Seebeck",
    "Peltier",
    "Doppler",
    "Coriolis",
    "Kelvin",
    "Celsius",
    "Ohm",
    "Kirchhoff",
    "Thevenin",
    "Norton",
    "WebAuthn",
    "OAuth",
    "OpenID",
    "Connect",
    "JSON",
    "Token",
    "Web",
    "Passkeys",
    "Kerberos",
    "Diffie",
    "Hellman",
    "Bellman",
    "Adam",
    "Nesterov",
    "Robbins",
    "Monro",
    "Tikhonov",
    "Lasso",
    "Ridge",
    "Monte",
    "Carlo",
    "Richardson",
    "Lax",
    "Stokes",
    "Navier",
    "Petrov",
    "Lagrange",
    "Lagrangian",
    "Hermite",
    "Simpson",
    "Romberg",
    "Verlet",
    "Störmer",
    "Adams",
    "Bashforth",
    "Moulton",
    "Dahlquist",
    "Rate",
    "Monotonic",
    "Earliest",
    "Deadline",
    "First",
    "Grafcet",
    "Sequential",
    "Function",
    "Chart",
    "Structured",
    "Text",
    "Ladder",
    "Diagram",
    "Block",
    "Instruction",
    "List",
    "Mealy",
    "Moore",
    "Boolean"
  ]
}
